{
  "schema_version": "1.0",
  "report_id": "scenario-03-enterprise",
  "generated_at": "2026-08-06T12:00:00Z",
  "question_language": "english",
  "report_mode": "architecture_transition_advisor",
  "executive_summary": "Hybridize data plane; defer model migration; gates on PII movement.",
  "layers": [
    {
      "components": [
        "component-a"
      ],
      "provider_or_technology": "category-managed-saas",
      "business_criticality": 3,
      "data_sensitivity": 5,
      "vendor_lock_in": 3,
      "portability": 2,
      "replaceability": 2,
      "recovery_capability": 2,
      "observability_clarity": 2,
      "progress_loss_risk": 2,
      "rework_risk": 2,
      "visible_cost": "UNKNOWN",
      "hidden_cost": "UNKNOWN",
      "migration_difficulty": 3,
      "outage_impact": 3,
      "assessment_confidence": "medium",
      "evidence_ids": [
        "ev-001"
      ],
      "user_must_retain_control": [
        "source documents"
      ],
      "layer_id": "data_knowledge"
    },
    {
      "components": [
        "component-a"
      ],
      "provider_or_technology": "category-managed-saas",
      "business_criticality": 3,
      "data_sensitivity": 2,
      "vendor_lock_in": 3,
      "portability": 2,
      "replaceability": 2,
      "recovery_capability": 2,
      "observability_clarity": 2,
      "progress_loss_risk": 2,
      "rework_risk": 2,
      "visible_cost": "UNKNOWN",
      "hidden_cost": "UNKNOWN",
      "migration_difficulty": 3,
      "outage_impact": 3,
      "assessment_confidence": "medium",
      "evidence_ids": [
        "ev-001"
      ],
      "user_must_retain_control": [
        "source documents"
      ],
      "layer_id": "models"
    },
    {
      "components": [
        "component-a"
      ],
      "provider_or_technology": "category-managed-saas",
      "business_criticality": 3,
      "data_sensitivity": 2,
      "vendor_lock_in": 3,
      "portability": 2,
      "replaceability": 2,
      "recovery_capability": 2,
      "observability_clarity": 2,
      "progress_loss_risk": 2,
      "rework_risk": 2,
      "visible_cost": "UNKNOWN",
      "hidden_cost": "UNKNOWN",
      "migration_difficulty": 3,
      "outage_impact": 3,
      "assessment_confidence": "medium",
      "evidence_ids": [
        "ev-001"
      ],
      "user_must_retain_control": [
        "source documents"
      ],
      "layer_id": "training_adaptation_evaluation"
    },
    {
      "components": [
        "component-a"
      ],
      "provider_or_technology": "category-managed-saas",
      "business_criticality": 3,
      "data_sensitivity": 2,
      "vendor_lock_in": 3,
      "portability": 2,
      "replaceability": 2,
      "recovery_capability": 2,
      "observability_clarity": 2,
      "progress_loss_risk": 2,
      "rework_risk": 2,
      "visible_cost": "UNKNOWN",
      "hidden_cost": "UNKNOWN",
      "migration_difficulty": 3,
      "outage_impact": 3,
      "assessment_confidence": "medium",
      "evidence_ids": [
        "ev-001"
      ],
      "user_must_retain_control": [
        "source documents"
      ],
      "layer_id": "applications_retrieval_agents"
    },
    {
      "components": [
        "component-a"
      ],
      "provider_or_technology": "category-managed-saas",
      "business_criticality": 3,
      "data_sensitivity": 2,
      "vendor_lock_in": 3,
      "portability": 2,
      "replaceability": 2,
      "recovery_capability": 2,
      "observability_clarity": 2,
      "progress_loss_risk": 2,
      "rework_risk": 2,
      "visible_cost": "UNKNOWN",
      "hidden_cost": "UNKNOWN",
      "migration_difficulty": 3,
      "outage_impact": 3,
      "assessment_confidence": "medium",
      "evidence_ids": [
        "ev-001"
      ],
      "user_must_retain_control": [
        "source documents"
      ],
      "layer_id": "inference_serving"
    },
    {
      "components": [
        "component-a"
      ],
      "provider_or_technology": "category-managed-saas",
      "business_criticality": 3,
      "data_sensitivity": 2,
      "vendor_lock_in": 3,
      "portability": 2,
      "replaceability": 2,
      "recovery_capability": 2,
      "observability_clarity": 2,
      "progress_loss_risk": 2,
      "rework_risk": 2,
      "visible_cost": "UNKNOWN",
      "hidden_cost": "UNKNOWN",
      "migration_difficulty": 3,
      "outage_impact": 3,
      "assessment_confidence": "medium",
      "evidence_ids": [
        "ev-001"
      ],
      "user_must_retain_control": [
        "source documents"
      ],
      "layer_id": "orchestration_execution"
    }
  ],
  "ownership_and_control_matrix": [
    {
      "item": "customer documents",
      "owner": "customer"
    }
  ],
  "lock_in_portability_matrix": {
    "summary": "elevated lock-in on data plane"
  },
  "recovery_assessment": {
    "checkpoints": false,
    "notes": "see orchestration layer"
  },
  "hidden_cost_assessment": {
    "notes": "re-embedding cost UNKNOWN"
  },
  "risk_signals": [
    {
      "id": "rs-1",
      "signal": "no_export_path",
      "evidence_id": "ev-001"
    }
  ],
  "recommendations": [
    {
      "id": "rec-hybrid",
      "layer_id": "data_knowledge",
      "action": "HYBRIDIZE",
      "current_problem": "PII in managed vector without residency controls",
      "evidence_ids": [
        "ev-001"
      ],
      "impact_if_unchanged": "Compliance exposure UNKNOWN without DPA review",
      "alternatives": [
        "self-hosted vector enclave",
        "customer-managed keys with hosted service"
      ],
      "selection_rationale": "data movement to production hybrid",
      "confidence": "low",
      "prerequisites": [
        "legal review"
      ],
      "phased_steps": [
        "pilot non-prod copy",
        "validate residency"
      ],
      "rollback_plan": "Revert routing to current managed index",
      "verification_tests": [
        "residency checklist",
        "access audit"
      ],
      "pilot_plan": {
        "scope": "non-prod subset",
        "duration": "2-4 weeks"
      },
      "human_gate_id": "gate-hybrid-01",
      "time_cost_estimate": "UNKNOWN",
      "transition_risks": [
        "data movement",
        "production"
      ]
    }
  ],
  "authorized_actions": [],
  "roadmap": {
    "immediate": [
      "document export requirements"
    ],
    "days_30": [
      "adapter spike"
    ],
    "days_90": [
      "pilot if metrics pass"
    ],
    "strategic": [
      "reassess managed vs hybrid"
    ]
  },
  "human_approval_gates": [
    {
      "gate_id": "gate-hybrid-01",
      "status": "PENDING_HUMAN_APPROVAL",
      "recommendation_action": "HYBRIDIZE",
      "reason": "PII data movement",
      "triggers": [
        "pii_data",
        "data_delete_replace_transfer"
      ],
      "authorized_action": null
    }
  ],
  "evidence": [
    {
      "id": "ev-001",
      "status": "VERIFIED",
      "statement": "User stated single closed vendor for RAG stack",
      "source": "scenario intake",
      "layer": "data_knowledge"
    }
  ],
  "assumptions": [
    "usage scale UNKNOWN"
  ],
  "no_bluff_statement": "Scores are qualitative; costs UNKNOWN unless stated.",
  "recommendation_vs_authorized_action_note": "Recommendations are analytical only; authorized_actions empty until user approves."
}