{
  "schema_version": "1.0",
  "report_id": "scenario-02-long-agent",
  "generated_at": "2026-08-06T12:00:00Z",
  "question_language": "english",
  "report_mode": "full_assessment",
  "executive_summary": "Orchestration recovery is critical; optimize checkpoints before any provider change.",
  "layers": [
    {
      "components": [
        "component-a"
      ],
      "provider_or_technology": "category-managed-saas",
      "business_criticality": 3,
      "data_sensitivity": 2,
      "vendor_lock_in": 3,
      "portability": 2,
      "replaceability": 2,
      "recovery_capability": 2,
      "observability_clarity": 2,
      "progress_loss_risk": 2,
      "rework_risk": 2,
      "visible_cost": "UNKNOWN",
      "hidden_cost": "UNKNOWN",
      "migration_difficulty": 3,
      "outage_impact": 3,
      "assessment_confidence": "medium",
      "evidence_ids": [
        "ev-001"
      ],
      "user_must_retain_control": [
        "source documents"
      ],
      "layer_id": "data_knowledge"
    },
    {
      "components": [
        "component-a"
      ],
      "provider_or_technology": "category-managed-saas",
      "business_criticality": 3,
      "data_sensitivity": 2,
      "vendor_lock_in": 3,
      "portability": 2,
      "replaceability": 2,
      "recovery_capability": 2,
      "observability_clarity": 2,
      "progress_loss_risk": 2,
      "rework_risk": 2,
      "visible_cost": "UNKNOWN",
      "hidden_cost": "UNKNOWN",
      "migration_difficulty": 3,
      "outage_impact": 3,
      "assessment_confidence": "medium",
      "evidence_ids": [
        "ev-001"
      ],
      "user_must_retain_control": [
        "source documents"
      ],
      "layer_id": "models"
    },
    {
      "components": [
        "component-a"
      ],
      "provider_or_technology": "category-managed-saas",
      "business_criticality": 3,
      "data_sensitivity": 2,
      "vendor_lock_in": 3,
      "portability": 2,
      "replaceability": 2,
      "recovery_capability": 2,
      "observability_clarity": 2,
      "progress_loss_risk": 2,
      "rework_risk": 2,
      "visible_cost": "UNKNOWN",
      "hidden_cost": "UNKNOWN",
      "migration_difficulty": 3,
      "outage_impact": 3,
      "assessment_confidence": "medium",
      "evidence_ids": [
        "ev-001"
      ],
      "user_must_retain_control": [
        "source documents"
      ],
      "layer_id": "training_adaptation_evaluation"
    },
    {
      "components": [
        "component-a"
      ],
      "provider_or_technology": "category-managed-saas",
      "business_criticality": 3,
      "data_sensitivity": 2,
      "vendor_lock_in": 3,
      "portability": 2,
      "replaceability": 2,
      "recovery_capability": 2,
      "observability_clarity": 2,
      "progress_loss_risk": 2,
      "rework_risk": 2,
      "visible_cost": "UNKNOWN",
      "hidden_cost": "UNKNOWN",
      "migration_difficulty": 3,
      "outage_impact": 3,
      "assessment_confidence": "medium",
      "evidence_ids": [
        "ev-001"
      ],
      "user_must_retain_control": [
        "source documents"
      ],
      "layer_id": "applications_retrieval_agents"
    },
    {
      "components": [
        "component-a"
      ],
      "provider_or_technology": "category-managed-saas",
      "business_criticality": 3,
      "data_sensitivity": 2,
      "vendor_lock_in": 3,
      "portability": 2,
      "replaceability": 2,
      "recovery_capability": 2,
      "observability_clarity": 2,
      "progress_loss_risk": 2,
      "rework_risk": 2,
      "visible_cost": "UNKNOWN",
      "hidden_cost": "UNKNOWN",
      "migration_difficulty": 3,
      "outage_impact": 3,
      "assessment_confidence": "medium",
      "evidence_ids": [
        "ev-001"
      ],
      "user_must_retain_control": [
        "source documents"
      ],
      "layer_id": "inference_serving"
    },
    {
      "components": [
        "component-a"
      ],
      "provider_or_technology": "category-managed-saas",
      "business_criticality": 3,
      "data_sensitivity": 2,
      "vendor_lock_in": 3,
      "portability": 2,
      "replaceability": 2,
      "recovery_capability": 0,
      "observability_clarity": 2,
      "progress_loss_risk": 5,
      "rework_risk": 2,
      "visible_cost": "UNKNOWN",
      "hidden_cost": "UNKNOWN",
      "migration_difficulty": 3,
      "outage_impact": 3,
      "assessment_confidence": "medium",
      "evidence_ids": [
        "ev-001"
      ],
      "user_must_retain_control": [
        "source documents"
      ],
      "layer_id": "orchestration_execution"
    }
  ],
  "ownership_and_control_matrix": [
    {
      "item": "customer documents",
      "owner": "customer"
    }
  ],
  "lock_in_portability_matrix": {
    "summary": "elevated lock-in on data plane"
  },
  "recovery_assessment": {
    "checkpoints": false,
    "resume": false
  },
  "hidden_cost_assessment": {
    "notes": "re-embedding cost UNKNOWN"
  },
  "risk_signals": [
    {
      "id": "rs-1",
      "signal": "no_export_path",
      "evidence_id": "ev-001"
    }
  ],
  "recommendations": [
    {
      "id": "rec-orch",
      "layer_id": "orchestration_execution",
      "action": "OPTIMIZE",
      "current_problem": "Full job restarts on single task failure",
      "evidence_ids": [
        "ev-001"
      ],
      "impact_if_unchanged": "Progress loss on long research runs",
      "alternatives": [
        "checkpoint to durable store",
        "task-level idempotency"
      ],
      "selection_rationale": "Failure cost dominates; not a migration problem",
      "confidence": "high",
      "prerequisites": [
        "identify resumable units"
      ],
      "phased_steps": [
        "add checkpoint store",
        "resume integration test"
      ],
      "rollback_plan": "Feature flag checkpoints off",
      "verification_tests": [
        "kill worker mid-run",
        "resume completes"
      ],
      "human_gate_id": "gate-opt-01",
      "time_cost_estimate": "2-4 weeks",
      "transition_risks": [
        "state schema churn"
      ]
    }
  ],
  "authorized_actions": [],
  "roadmap": {
    "immediate": [
      "document export requirements"
    ],
    "days_30": [
      "adapter spike"
    ],
    "days_90": [
      "pilot if metrics pass"
    ],
    "strategic": [
      "reassess managed vs hybrid"
    ]
  },
  "human_approval_gates": [
    {
      "gate_id": "gate-opt-01",
      "status": "PENDING_HUMAN_APPROVAL",
      "recommendation_action": "OPTIMIZE",
      "reason": "Touches production job runner",
      "triggers": [
        "hard_to_reverse"
      ],
      "authorized_action": null
    }
  ],
  "evidence": [
    {
      "id": "ev-001",
      "status": "VERIFIED",
      "statement": "User stated single closed vendor for RAG stack",
      "source": "scenario intake",
      "layer": "data_knowledge"
    }
  ],
  "assumptions": [
    "usage scale UNKNOWN"
  ],
  "no_bluff_statement": "Scores are qualitative; costs UNKNOWN unless stated.",
  "recommendation_vs_authorized_action_note": "Recommendations are analytical only; authorized_actions empty until user approves."
}